{"$id":"https://martin-beck.github.io/agent-workflow-quality/schemas/refinement-map.schema.json","$schema":"https://json-schema.org/draft/2020-12/schema","additionalProperties":false,"properties":{"action_map":{"items":{"additionalProperties":false,"properties":{"implementation":{"pattern":"^ACTION-[0-9]{4}$","type":"string"},"model":{"enum":["edit","tick","finish-review","enforce","begin-review-0","begin-review-1","begin-review-2"]}},"required":["model","implementation"],"type":"object"},"maxItems":7,"minItems":6,"type":"array"},"assumptions":{"const":["atomic-interleaved-actions","bounded-monotonic-clock","bounded-monotonic-revisions","honest-review-records","single-policy-owner","caller-declared-implementation-traces","exact-one-step-projection","reviewed-observation-abstraction","no-hidden-actions-or-state-claim"]},"bounds":{"additionalProperties":false,"properties":{"actors":{"maximum":3,"minimum":2,"type":"integer"},"review_ttl":{"maximum":3,"minimum":1,"type":"integer"},"revisions":{"maximum":3,"minimum":1,"type":"integer"},"ticks":{"maximum":6,"minimum":1,"type":"integer"}},"required":["actors","revisions","ticks","review_ttl"],"type":"object"},"implementation_source_sha256":{"pattern":"^[0-9a-f]{64}$","type":"string"},"kind":{"const":"refinement"},"map_version":{"const":1},"model":{"const":"review-promotion-v1"},"model_sha256":{"pattern":"^[0-9a-f]{64}$","type":"string"},"obligations":{"items":{"additionalProperties":false,"properties":{"evidence_sha256":{"pattern":"^[0-9a-f]{64}$","type":"string"},"id":{"enum":["bounds","initial-state","invariant-preservation","state-projection","trace-coverage","transition-simulation"]},"owner":{"pattern":"^OWNER-[A-Z0-9]{4,32}$","type":"string"},"review_sha256":{"pattern":"^[0-9a-f]{64}$","type":"string"}},"required":["id","owner","review_sha256","evidence_sha256"],"type":"object"},"maxItems":6,"minItems":6,"type":"array"},"schema_version":{"const":1},"state_map":{"items":{"additionalProperties":false,"properties":{"implementation":{"pattern":"^FIELD-[0-9]{4}$","type":"string"},"model":{"enum":["enforced","pending_reviewer","pending_revision","pending_tick","review_tick","reviewed_revision","reviewer","revision","tick"]}},"required":["model","implementation"],"type":"object"},"maxItems":9,"minItems":9,"type":"array"},"traces":{"items":{"additionalProperties":false,"properties":{"id":{"pattern":"^TRACE-[0-9]{4}$","type":"string"},"implementation_initial":{"additionalProperties":false,"maxProperties":9,"minProperties":9,"patternProperties":{"^FIELD-[0-9]{4}$":{"oneOf":[{"maximum":6,"minimum":-1,"type":"integer"},{"type":"boolean"}]}},"type":"object"},"implementation_trace_sha256":{"pattern":"^[0-9a-f]{64}$","type":"string"},"model_initial":{"additionalProperties":false,"properties":{"enforced":{"type":"boolean"},"pending_reviewer":{"maximum":6,"minimum":-1,"type":"integer"},"pending_revision":{"maximum":6,"minimum":-1,"type":"integer"},"pending_tick":{"maximum":6,"minimum":-1,"type":"integer"},"review_tick":{"maximum":6,"minimum":-1,"type":"integer"},"reviewed_revision":{"maximum":6,"minimum":-1,"type":"integer"},"reviewer":{"maximum":6,"minimum":-1,"type":"integer"},"revision":{"maximum":6,"minimum":-1,"type":"integer"},"tick":{"maximum":6,"minimum":-1,"type":"integer"}},"required":["enforced","pending_reviewer","pending_revision","pending_tick","review_tick","reviewed_revision","reviewer","revision","tick"],"type":"object"},"steps":{"items":{"additionalProperties":false,"properties":{"implementation_action":{"pattern":"^ACTION-[0-9]{4}$","type":"string"},"implementation_state":{"additionalProperties":false,"maxProperties":9,"minProperties":9,"patternProperties":{"^FIELD-[0-9]{4}$":{"oneOf":[{"maximum":6,"minimum":-1,"type":"integer"},{"type":"boolean"}]}},"type":"object"},"model_action":{"enum":["edit","tick","finish-review","enforce","begin-review-0","begin-review-1","begin-review-2"]},"model_state":{"additionalProperties":false,"properties":{"enforced":{"type":"boolean"},"pending_reviewer":{"maximum":6,"minimum":-1,"type":"integer"},"pending_revision":{"maximum":6,"minimum":-1,"type":"integer"},"pending_tick":{"maximum":6,"minimum":-1,"type":"integer"},"review_tick":{"maximum":6,"minimum":-1,"type":"integer"},"reviewed_revision":{"maximum":6,"minimum":-1,"type":"integer"},"reviewer":{"maximum":6,"minimum":-1,"type":"integer"},"revision":{"maximum":6,"minimum":-1,"type":"integer"},"tick":{"maximum":6,"minimum":-1,"type":"integer"}},"required":["enforced","pending_reviewer","pending_revision","pending_tick","review_tick","reviewed_revision","reviewer","revision","tick"],"type":"object"}},"required":["model_action","implementation_action","model_state","implementation_state"],"type":"object"},"maxItems":64,"minItems":1,"type":"array"}},"required":["id","model_initial","implementation_initial","steps","implementation_trace_sha256"],"type":"object"},"maxItems":64,"minItems":1,"type":"array"}},"required":["schema_version","kind","map_version","model","model_sha256","implementation_source_sha256","bounds","assumptions","state_map","action_map","obligations","traces"],"title":"AWQ bounded trace correspondence v1","type":"object"}
