{"action_map":[{"implementation":"ACTION-0000","model":"begin-review-0"},{"implementation":"ACTION-0001","model":"begin-review-1"},{"implementation":"ACTION-0002","model":"edit"},{"implementation":"ACTION-0003","model":"enforce"},{"implementation":"ACTION-0004","model":"finish-review"},{"implementation":"ACTION-0005","model":"tick"}],"assumptions":["atomic-interleaved-actions","bounded-monotonic-clock","bounded-monotonic-revisions","honest-review-records","single-policy-owner","caller-declared-implementation-traces","exact-one-step-projection","reviewed-observation-abstraction","no-hidden-actions-or-state-claim"],"bounds":{"actors":2,"review_ttl":1,"revisions":1,"ticks":7},"implementation_source_sha256":"aaaaaaaaaaaaaaaaaaaaaaaaaaaaaaaaaaaaaaaaaaaaaaaaaaaaaaaaaaaaaaaa","kind":"refinement","map_version":1,"model":"review-promotion-v1","model_sha256":"582748fe7f60c0c8f9b054e581a6b4c10323ba3f23437dfde902b4a7f060006f","obligations":[{"evidence_sha256":"15dc4e57dfc7f26d6712e313f35c9c9d96d8604509414f0c7ca014b03c5164f0","id":"bounds","owner":"OWNER-DEMO","review_sha256":"bbbbbbbbbbbbbbbbbbbbbbbbbbbbbbbbbbbbbbbbbbbbbbbbbbbbbbbbbbbbbbbb"},{"evidence_sha256":"15dc4e57dfc7f26d6712e313f35c9c9d96d8604509414f0c7ca014b03c5164f0","id":"initial-state","owner":"OWNER-DEMO","review_sha256":"bbbbbbbbbbbbbbbbbbbbbbbbbbbbbbbbbbbbbbbbbbbbbbbbbbbbbbbbbbbbbbbb"},{"evidence_sha256":"15dc4e57dfc7f26d6712e313f35c9c9d96d8604509414f0c7ca014b03c5164f0","id":"invariant-preservation","owner":"OWNER-DEMO","review_sha256":"bbbbbbbbbbbbbbbbbbbbbbbbbbbbbbbbbbbbbbbbbbbbbbbbbbbbbbbbbbbbbbbb"},{"evidence_sha256":"15dc4e57dfc7f26d6712e313f35c9c9d96d8604509414f0c7ca014b03c5164f0","id":"state-projection","owner":"OWNER-DEMO","review_sha256":"bbbbbbbbbbbbbbbbbbbbbbbbbbbbbbbbbbbbbbbbbbbbbbbbbbbbbbbbbbbbbbbb"},{"evidence_sha256":"15dc4e57dfc7f26d6712e313f35c9c9d96d8604509414f0c7ca014b03c5164f0","id":"trace-coverage","owner":"OWNER-DEMO","review_sha256":"bbbbbbbbbbbbbbbbbbbbbbbbbbbbbbbbbbbbbbbbbbbbbbbbbbbbbbbbbbbbbbbb"},{"evidence_sha256":"15dc4e57dfc7f26d6712e313f35c9c9d96d8604509414f0c7ca014b03c5164f0","id":"transition-simulation","owner":"OWNER-DEMO","review_sha256":"bbbbbbbbbbbbbbbbbbbbbbbbbbbbbbbbbbbbbbbbbbbbbbbbbbbbbbbbbbbbbbbb"}],"schema_version":1,"state_map":[{"implementation":"FIELD-0000","model":"enforced"},{"implementation":"FIELD-0001","model":"pending_reviewer"},{"implementation":"FIELD-0002","model":"pending_revision"},{"implementation":"FIELD-0003","model":"pending_tick"},{"implementation":"FIELD-0004","model":"review_tick"},{"implementation":"FIELD-0005","model":"reviewed_revision"},{"implementation":"FIELD-0006","model":"reviewer"},{"implementation":"FIELD-0007","model":"revision"},{"implementation":"FIELD-0008","model":"tick"}],"traces":[{"id":"TRACE-0000","implementation_initial":{"FIELD-0000":false,"FIELD-0001":-1,"FIELD-0002":-1,"FIELD-0003":-1,"FIELD-0004":-1,"FIELD-0005":-1,"FIELD-0006":-1,"FIELD-0007":0,"FIELD-0008":0},"implementation_trace_sha256":"c49b65262ada1bbff876404e76767eac06f4fd4072fac699179ccd90d89046b1","model_initial":{"enforced":false,"pending_reviewer":-1,"pending_revision":-1,"pending_tick":-1,"review_tick":-1,"reviewed_revision":-1,"reviewer":-1,"revision":0,"tick":0},"steps":[{"implementation_action":"ACTION-0002","implementation_state":{"FIELD-0000":false,"FIELD-0001":-1,"FIELD-0002":-1,"FIELD-0003":-1,"FIELD-0004":-1,"FIELD-0005":-1,"FIELD-0006":-1,"FIELD-0007":1,"FIELD-0008":0},"model_action":"edit","model_state":{"enforced":false,"pending_reviewer":-1,"pending_revision":-1,"pending_tick":-1,"review_tick":-1,"reviewed_revision":-1,"reviewer":-1,"revision":1,"tick":0}}]},{"id":"TRACE-0001","implementation_initial":{"FIELD-0000":false,"FIELD-0001":-1,"FIELD-0002":-1,"FIELD-0003":-1,"FIELD-0004":-1,"FIELD-0005":-1,"FIELD-0006":-1,"FIELD-0007":0,"FIELD-0008":0},"implementation_trace_sha256":"8ad8f0b63871b46b1a830574288b776a521654f95d13dcad2d4fdacea09ea0a9","model_initial":{"enforced":false,"pending_reviewer":-1,"pending_revision":-1,"pending_tick":-1,"review_tick":-1,"reviewed_revision":-1,"reviewer":-1,"revision":0,"tick":0},"steps":[{"implementation_action":"ACTION-0005","implementation_state":{"FIELD-0000":false,"FIELD-0001":-1,"FIELD-0002":-1,"FIELD-0003":-1,"FIELD-0004":-1,"FIELD-0005":-1,"FIELD-0006":-1,"FIELD-0007":0,"FIELD-0008":1},"model_action":"tick","model_state":{"enforced":false,"pending_reviewer":-1,"pending_revision":-1,"pending_tick":-1,"review_tick":-1,"reviewed_revision":-1,"reviewer":-1,"revision":0,"tick":1}}]},{"id":"TRACE-0002","implementation_initial":{"FIELD-0000":false,"FIELD-0001":-1,"FIELD-0002":-1,"FIELD-0003":-1,"FIELD-0004":-1,"FIELD-0005":-1,"FIELD-0006":-1,"FIELD-0007":0,"FIELD-0008":0},"implementation_trace_sha256":"b1f2360c88b3ab9b3b74f20f06bec011619e7c9a49ffd34bb8af556344cdabdb","model_initial":{"enforced":false,"pending_reviewer":-1,"pending_revision":-1,"pending_tick":-1,"review_tick":-1,"reviewed_revision":-1,"reviewer":-1,"revision":0,"tick":0},"steps":[{"implementation_action":"ACTION-0000","implementation_state":{"FIELD-0000":false,"FIELD-0001":0,"FIELD-0002":0,"FIELD-0003":0,"FIELD-0004":-1,"FIELD-0005":-1,"FIELD-0006":-1,"FIELD-0007":0,"FIELD-0008":0},"model_action":"begin-review-0","model_state":{"enforced":false,"pending_reviewer":0,"pending_revision":0,"pending_tick":0,"review_tick":-1,"reviewed_revision":-1,"reviewer":-1,"revision":0,"tick":0}},{"implementation_action":"ACTION-0004","implementation_state":{"FIELD-0000":false,"FIELD-0001":-1,"FIELD-0002":-1,"FIELD-0003":-1,"FIELD-0004":0,"FIELD-0005":0,"FIELD-0006":0,"FIELD-0007":0,"FIELD-0008":0},"model_action":"finish-review","model_state":{"enforced":false,"pending_reviewer":-1,"pending_revision":-1,"pending_tick":-1,"review_tick":0,"reviewed_revision":0,"reviewer":0,"revision":0,"tick":0}}]},{"id":"TRACE-0003","implementation_initial":{"FIELD-0000":false,"FIELD-0001":-1,"FIELD-0002":-1,"FIELD-0003":-1,"FIELD-0004":-1,"FIELD-0005":-1,"FIELD-0006":-1,"FIELD-0007":0,"FIELD-0008":0},"implementation_trace_sha256":"e0279a6e02ef5fe8aedc170dc5d7e38cb26e10e6e87107867e773a9246db3c69","model_initial":{"enforced":false,"pending_reviewer":-1,"pending_revision":-1,"pending_tick":-1,"review_tick":-1,"reviewed_revision":-1,"reviewer":-1,"revision":0,"tick":0},"steps":[{"implementation_action":"ACTION-0001","implementation_state":{"FIELD-0000":false,"FIELD-0001":1,"FIELD-0002":0,"FIELD-0003":0,"FIELD-0004":-1,"FIELD-0005":-1,"FIELD-0006":-1,"FIELD-0007":0,"FIELD-0008":0},"model_action":"begin-review-1","model_state":{"enforced":false,"pending_reviewer":1,"pending_revision":0,"pending_tick":0,"review_tick":-1,"reviewed_revision":-1,"reviewer":-1,"revision":0,"tick":0}},{"implementation_action":"ACTION-0004","implementation_state":{"FIELD-0000":false,"FIELD-0001":-1,"FIELD-0002":-1,"FIELD-0003":-1,"FIELD-0004":0,"FIELD-0005":0,"FIELD-0006":1,"FIELD-0007":0,"FIELD-0008":0},"model_action":"finish-review","model_state":{"enforced":false,"pending_reviewer":-1,"pending_revision":-1,"pending_tick":-1,"review_tick":0,"reviewed_revision":0,"reviewer":1,"revision":0,"tick":0}},{"implementation_action":"ACTION-0003","implementation_state":{"FIELD-0000":true,"FIELD-0001":-1,"FIELD-0002":-1,"FIELD-0003":-1,"FIELD-0004":0,"FIELD-0005":0,"FIELD-0006":1,"FIELD-0007":0,"FIELD-0008":0},"model_action":"enforce","model_state":{"enforced":true,"pending_reviewer":-1,"pending_revision":-1,"pending_tick":-1,"review_tick":0,"reviewed_revision":0,"reviewer":1,"revision":0,"tick":0}}]}]}
